[
  {
    "id": 1,
    "name": "Ability to represent null values",
    "category": "Format",
    "iso25012Characteristic": "Compliance",
    "isoReference": "ISO/IEC 25012:2008 & ISO 8000-8 / ETSI EN 304 311",
    "iso38505Role": "Contextual operational measurement indicator (ISO/IEC 38505-1:2026 & ISO/IEC TR 38505-2:2018)",
    "definition": "The degree to which a format allows null values in an attribute.",
    "unitOfMeasure": "Yes/No",
    "relatedDimensionIds": [],
    "examplePoor": [
      "Logistics: A required field (e.g., 'Hazardous Material Class') does not allow nulls, forcing users to enter a default non-hazardous class when the real value is unknown or not applicable for a non-hazardous item.",
      "HR: A 'Termination Date' field in an employee system does not allow nulls, forcing entry of a dummy future date for active employees.",
      "E-commerce: A 'Discount Code Applied' field in an order form cannot be left blank, requiring a 'NONE' value instead of a true null."
    ],
    "exampleGood": [
      "Logistics: An optional field (e.g., 'Special Handling Instructions') correctly allows null values when no special instructions are needed.",
      "HR: A 'Middle Name' field in an employee record correctly allows null if the employee does not have one.",
      "E-commerce: A 'Customer Loyalty ID' field in a guest checkout form allows nulls, as guests wouldn't have one."
    ],
    "potentialBusinessImpacts": {
      "positive": [
        "Accurate representation of missing or inapplicable information, preventing misinterpretation.",
        "Improved data integrity by distinguishing between a zero value and an unknown value.",
        "More effective data analysis as nulls can be handled appropriately (e.g., excluded or imputed).",
        "Reduced data entry errors caused by forcing users to input dummy values."
      ],
      "negative": [
        "Misinterpretation of data if nulls are not allowed and dummy values (e.g., 0, 'N/A') are used inconsistently.",
        "Skewed analytical results if dummy values are treated as real data.",
        "Increased data cleansing effort to identify and correct inappropriately used dummy values.",
        "Process failures if systems expect true nulls but receive ambiguous placeholders."
      ]
    },
    "illustrativeKpis": [
      "Data Cleansing Effort/Cost",
      "Analytical Model Accuracy",
      "Report Accuracy",
      "Data Entry Error Rate"
    ],
    "framework_tags": {
      "iso_25012": "Compliance",
      "iso_38505_edm": "Monitor (ISO/IEC TR 38505-2:2018)"
    }
  },
  {
    "id": 2,
    "name": "Access security",
    "category": "Datasets",
    "iso25012Characteristic": "Confidentiality",
    "isoReference": "ISO/IEC 25012:2008 & ISO 8000-8 / ETSI EN 304 311",
    "iso38505Role": "Contextual operational measurement indicator (ISO/IEC 38505-1:2026 & ISO/IEC TR 38505-2:2018)",
    "definition": "The degree to which access to datasets is restricted.",
    "unitOfMeasure": "Grade",
    "relatedDimensionIds": [],
    "examplePoor": [
      "Logistics: Customer contract details and pricing accessible by all terminal operations staff.",
      "Finance: All employees can view salary information for everyone in the company.",
      "Healthcare: Patient medical history datasets are accessible via a shared network drive with no specific access controls."
    ],
    "exampleGood": [
      "Logistics: Access to sensitive financial data (e.g., terminal revenue) is restricted based on user roles (e.g., finance department only).",
      "Finance: Only HR managers and direct line managers can access employee performance review datasets.",
      "Healthcare: Access to patient electronic health records (EHR) is strictly controlled by role-based access, logged, and audited."
    ],
    "potentialBusinessImpacts": {
      "positive": [
        "Protection of sensitive company, customer, and employee data, maintaining trust and legal standing.",
        "Reduced risk of data breaches, leading to avoidance of financial losses, regulatory fines, and reputational damage.",
        "Ensured compliance with data privacy regulations (e.g., GDPR, CCPA, HIPAA).",
        "Preservation of competitive advantage by safeguarding intellectual property and strategic plans."
      ],
      "negative": [
        "Data breaches resulting in direct financial costs (remediation, fines), legal liabilities, and loss of intellectual property.",
        "Severe reputational damage and erosion of customer, partner, and employee trust.",
        "Unauthorized access, modification, or misuse of sensitive information leading to competitive disadvantage or operational disruption.",
        "Non-compliance with data privacy laws, attracting significant penalties and sanctions."
      ]
    },
    "illustrativeKpis": [
      "Number of Security Incidents/Breaches",
      "Cost of Compliance Fines (Security)",
      "Customer Churn Rate (post-breach)",
      "Brand Reputation Score",
      "Time to Detect Security Incidents"
    ],
    "framework_tags": {
      "iso_25012": "Confidentiality",
      "iso_38505_edm": "Monitor (ISO/IEC TR 38505-2:2018)"
    }
  },
  {
    "id": 3,
    "name": "Accessibility",
    "category": "Data",
    "iso25012Characteristic": "Accessibility",
    "isoReference": "ISO/IEC 25012:2008 & ISO 8000-8 / ETSI EN 304 311",
    "iso38505Role": "Contextual operational measurement indicator (ISO/IEC 38505-1:2026 & ISO/IEC TR 38505-2:2018)",
    "definition": "The ease with which data can be consulted or retrieved.",
    "unitOfMeasure": "Grade",
    "relatedDimensionIds": [
      37
    ],
    "examplePoor": [
      "Logistics: Yard planners cannot easily access real-time container location data; requires logging into multiple slow, disparate systems.",
      "Retail: Store managers need to request sales reports from HQ, which takes 2 days to generate, hindering timely stock decisions.",
      "Research: Historical experiment data is stored in proprietary formats on offline tapes, making it very difficult to access for new analysis."
    ],
    "exampleGood": [
      "Logistics: Planners have a single, responsive dashboard providing fast access to up-to-date container locations and vessel schedules.",
      "Retail: A self-service BI portal allows store managers to instantly generate custom sales reports for their location.",
      "Research: All research data is archived in a well-documented, searchable digital repository with open-format options."
    ],
    "potentialBusinessImpacts": {
      "positive": [
        "Faster, more informed decision-making through quick and easy access to necessary information.",
        "Increased employee productivity and operational efficiency as less time is wasted searching for data.",
        "Improved collaboration and knowledge sharing as data can be readily consulted by authorized users.",
        "Enhanced agility in responding to customer needs, market changes, or operational issues."
      ],
      "negative": [
        "Delayed or suboptimal decision-making due to difficulties in finding, retrieving, or understanding available data.",
        "Reduced employee productivity, increased frustration, and wasted resources searching for information.",
        "Information silos hindering cross-departmental collaboration and a unified view of the business.",
        "Slower response times to market opportunities, competitive threats, or critical operational events."
      ]
    },
    "illustrativeKpis": [
      "Time to Decision",
      "Employee Productivity Rate",
      "Project Completion Time",
      "Customer Service Resolution Time",
      "Data Search Time"
    ],
    "framework_tags": {
      "iso_25012": "Accessibility",
      "iso_38505_edm": "Monitor (ISO/IEC TR 38505-2:2018)"
    }
  },
  {
    "id": 4,
    "name": "Accuracy",
    "category": "Data values",
    "iso25012Characteristic": "Accuracy",
    "isoReference": "ISO/IEC 25012:2008 & ISO 8000-8 / ETSI EN 304 311",
    "iso38505Role": "Contextual operational measurement indicator (ISO/IEC 38505-1:2026 & ISO/IEC TR 38505-2:2018)",
    "definition": "The degree of closeness of data values to real values.",
    "unitOfMeasure": "%",
    "relatedDimensionIds": [],
    "examplePoor": [
      "Logistics: Incorrect container weight recorded differs significantly from actual weight, causing unsafe lifts or incorrect billing.",
      "Healthcare: Patient's date of birth recorded as 10/15/2023 instead of 10/15/1983 in their medical record.",
      "Finance: Stock price in a portfolio tracking system shows $150.00 but the actual current market price is $152.50."
    ],
    "exampleGood": [
      "Logistics: Package weight in system matches verified gross mass (VGM), ensuring safe handling and accurate charges.",
      "Healthcare: Patient's allergy information in the Electronic Health Record (EHR) accurately reflects all their known allergies.",
      "Finance: The account balance displayed to a customer matches the confirmed ledger balance after all transactions are processed for the day."
    ],
    "potentialBusinessImpacts": {
      "positive": [
        "Improved strategic and operational decision-making based on reliable, factual data.",
        "Increased operational efficiency by reducing errors, rework, and waste (e.g., accurate shipping, correct billing, precise manufacturing).",
        "Enhanced customer trust and satisfaction (e.g., correct personal details, accurate product information, fair pricing).",
        "Reliable financial reporting, forecasting, auditability, and investor confidence.",
        "Foundation for trustworthy and effective AI/ML model outputs and predictions."
      ],
      "negative": [
        "Flawed strategic decisions based on incorrect data leading to misallocated resources or missed opportunities.",